{
  "meta": {
    "dataVersion": "0.1.0",
    "extractedOn": "2026-10-18",
    "complete": true,
    "tier": "srd",
    "textPolicy": "srd-verbatim",
    "attribution": "This work includes material from the System Reference Document 5.2.1 (\"SRD 5.2.1\") by Wizards of the Coast LLC, available at https://www.dndbeyond.com/srd. The SRD 5.2.1 is licensed under the Creative Commons Attribution 4.0 International License, available at https://creativecommons.org/licenses/by/4.0/legalcode.",
    "notes": "Covers the Equipment chapter, SRD 5.2.1 pp.89-103: coins, weapon properties, mastery properties, the Weapons table, the Armor table, tools, and Adventuring Gear, with rule records for the chapter's rules a sheet uses, and for crafting nonmagical items, brewing Potions of Healing and scribing Spell Scrolls (p.103). Left out as records, by design: Mounts and Vehicles (Mounts and Cargo, Barding, Saddles, the Mounts and Other Animals table, Tack, Harness, and Drawn Vehicles, Large Vehicles and the Airborne and Waterborne Vehicles table, Crew, Passengers, Damage Threshold, Ship Repair; pp.100-101), Lifestyle Expenses (p.101), Food, Drink, and Lodging (pp.101-102), Hirelings (p.102), Spellcasting services (p.102), and Magic Items (Identifying, Attunement, Wearing and Wielding, Multiple Items of the Same Kind, Paired Items; pp.102-103), and the Improvised Weapons sidebar (p.90), which only points to the Rules Glossary. Where a gear entry has variant forms (Ammunition, Arcane Focus, Druidic Focus, Holy Symbol) the file carries the entry itself and one record per form in its table; the entry's cost and weight are printed as Varies, which the schema cannot hold, so they are 0 with confidence inferred and a note (likewise Gaming Set and Musical Instrument among tools). Gear ids follow the Adventuring Gear table's names, so inverted names keep their comma order (clothes-fine, lantern-hooded, case-map-or-scroll)."
  },
  "coins": [
    {
      "id": "cp",
      "name": "Copper Piece",
      "valueInGp": 0.01,
      "source": {
        "ref": "srd-5.2.1",
        "section": "Equipment > Coins",
        "page": 89,
        "table": "Coin Values"
      },
      "confidence": "printed"
    },
    {
      "id": "sp",
      "name": "Silver Piece",
      "valueInGp": 0.1,
      "source": {
        "ref": "srd-5.2.1",
        "section": "Equipment > Coins",
        "page": 89,
        "table": "Coin Values"
      },
      "confidence": "printed"
    },
    {
      "id": "ep",
      "name": "Electrum Piece",
      "valueInGp": 0.5,
      "source": {
        "ref": "srd-5.2.1",
        "section": "Equipment > Coins",
        "page": 89,
        "table": "Coin Values"
      },
      "confidence": "printed"
    },
    {
      "id": "gp",
      "name": "Gold Piece",
      "valueInGp": 1,
      "source": {
        "ref": "srd-5.2.1",
        "section": "Equipment > Coins",
        "page": 89,
        "table": "Coin Values"
      },
      "confidence": "printed"
    },
    {
      "id": "pp",
      "name": "Platinum Piece",
      "valueInGp": 10,
      "source": {
        "ref": "srd-5.2.1",
        "section": "Equipment > Coins",
        "page": 89,
        "table": "Coin Values"
      },
      "confidence": "printed"
    }
  ],
  "weaponProperties": [
    {
      "id": "ammunition",
      "name": "Ammunition",
      "text": "You can use a weapon that has the Ammunition property to make a ranged attack only if you have ammunition to fire from it. The type of ammunition required is specified with the weapon’s range. Each attack expends one piece of ammunition. Drawing the ammunition is part of the attack (you need a free hand to load a one-handed weapon). After a fight, you can spend 1 minute to recover half the ammunition (round down) you used in the fight; the rest is lost.",
      "source": {
        "ref": "srd-5.2.1",
        "section": "Equipment > Weapons > Properties > Ammunition",
        "page": 89
      },
      "confidence": "printed"
    },
    {
      "id": "finesse",
      "name": "Finesse",
      "text": "When making an attack with a Finesse weapon, use your choice of your Strength or Dexterity modifier for the attack and damage rolls. You must use the same modifier for both rolls.",
      "source": {
        "ref": "srd-5.2.1",
        "section": "Equipment > Weapons > Properties > Finesse",
        "page": 89
      },
      "confidence": "printed"
    },
    {
      "id": "heavy",
      "name": "Heavy",
      "text": "You have Disadvantage on attack rolls with a Heavy weapon if it’s a Melee weapon and your Strength score isn’t at least 13 or if it’s a Ranged weapon and your Dexterity score isn’t at least 13.",
      "source": {
        "ref": "srd-5.2.1",
        "section": "Equipment > Weapons > Properties > Heavy",
        "page": 89
      },
      "confidence": "printed"
    },
    {
      "id": "light",
      "name": "Light",
      "text": "When you take the Attack action on your turn and attack with a Light weapon, you can make one extra attack as a Bonus Action later on the same turn. That extra attack must be made with a different Light weapon, and you don’t add your ability modifier to the extra attack’s damage unless that modifier is negative. For example, you can attack with a Shortsword in one hand and a Dagger in the other using the Attack action and a Bonus Action, but you don’t add your Strength or Dexterity modifier to the damage roll of the Bonus Action unless that modifier is negative.",
      "source": {
        "ref": "srd-5.2.1",
        "section": "Equipment > Weapons > Properties > Light",
        "page": 89
      },
      "confidence": "printed"
    },
    {
      "id": "loading",
      "name": "Loading",
      "text": "You can fire only one piece of ammunition from a Loading weapon when you use an action, a Bonus Action, or a Reaction to fire it, regardless of the number of attacks you can normally make.",
      "source": {
        "ref": "srd-5.2.1",
        "section": "Equipment > Weapons > Properties > Loading",
        "page": 90
      },
      "confidence": "printed"
    },
    {
      "id": "range",
      "name": "Range",
      "text": "A Range weapon has a range in parentheses after the Ammunition or Thrown property. The range lists two numbers. The first is the weapon’s normal range in feet, and the second is the weapon’s long range. When attacking a target beyond normal range, you have Disadvantage on the attack roll. You can’t attack a target beyond the long range.",
      "source": {
        "ref": "srd-5.2.1",
        "section": "Equipment > Weapons > Properties > Range",
        "page": 90
      },
      "confidence": "printed"
    },
    {
      "id": "reach",
      "name": "Reach",
      "text": "A Reach weapon adds 5 feet to your reach when you attack with it, as well as when determining your reach for Opportunity Attacks with it.",
      "source": {
        "ref": "srd-5.2.1",
        "section": "Equipment > Weapons > Properties > Reach",
        "page": 90
      },
      "confidence": "printed"
    },
    {
      "id": "thrown",
      "name": "Thrown",
      "text": "If a weapon has the Thrown property, you can throw the weapon to make a ranged attack, and you can draw that weapon as part of the attack. If the weapon is a Melee weapon, use the same ability modifier for the attack and damage rolls that you use for a melee attack with that weapon.",
      "source": {
        "ref": "srd-5.2.1",
        "section": "Equipment > Weapons > Properties > Thrown",
        "page": 90
      },
      "confidence": "printed"
    },
    {
      "id": "two-handed",
      "name": "Two-Handed",
      "text": "A Two-Handed weapon requires two hands when you attack with it.",
      "source": {
        "ref": "srd-5.2.1",
        "section": "Equipment > Weapons > Properties > Two-Handed",
        "page": 90
      },
      "confidence": "printed"
    },
    {
      "id": "versatile",
      "name": "Versatile",
      "text": "A Versatile weapon can be used with one or two hands. A damage value in parentheses appears with the property. The weapon deals that damage when used with two hands to make a melee attack.",
      "source": {
        "ref": "srd-5.2.1",
        "section": "Equipment > Weapons > Properties > Versatile",
        "page": 90
      },
      "confidence": "printed"
    }
  ],
  "masteryProperties": [
    {
      "id": "cleave",
      "name": "Cleave",
      "text": "If you hit a creature with a melee attack roll using this weapon, you can make a melee attack roll with the weapon against a second creature within 5 feet of the first that is also within your reach. On a hit, the second creature takes the weapon’s damage, but don’t add your ability modifier to that damage unless that modifier is negative. You can make this extra attack only once per turn.",
      "source": {
        "ref": "srd-5.2.1",
        "section": "Equipment > Weapons > Mastery Properties > Cleave",
        "page": 90
      },
      "confidence": "printed"
    },
    {
      "id": "graze",
      "name": "Graze",
      "text": "If your attack roll with this weapon misses a creature, you can deal damage to that creature equal to the ability modifier you used to make the attack roll. This damage is the same type dealt by the weapon, and the damage can be increased only by increasing the ability modifier.",
      "source": {
        "ref": "srd-5.2.1",
        "section": "Equipment > Weapons > Mastery Properties > Graze",
        "page": 90
      },
      "confidence": "printed"
    },
    {
      "id": "nick",
      "name": "Nick",
      "text": "When you make the extra attack of the Light property, you can make it as part of the Attack action instead of as a Bonus Action. You can make this extra attack only once per turn.",
      "source": {
        "ref": "srd-5.2.1",
        "section": "Equipment > Weapons > Mastery Properties > Nick",
        "page": 90
      },
      "confidence": "printed"
    },
    {